[
  {
    "searchId": "postwar-germany-search-001",
    "date": "2026-08-13",
    "query": "\"Basic Law\" Article 1 Article 79 eternity clause human dignity",
    "database": "PPW bibliography and official source pack",
    "purpose": "supporting",
    "inclusionCriteria": [
      "primary constitutional text",
      "direct relevance to dignity, amendment limits, or democratic order"
    ],
    "exclusionCriteria": [
      "commentary without link to the scored constitutional mechanism"
    ],
    "resultsCount": 2,
    "screenedCount": 2,
    "includedSourceIds": [
      "grundgesetz-1949",
      "adenauer-regierungserklaerung-1949"
    ],
    "notes": "Search supports the constitutional-containment and memory-driven-restraint readings already present in the Postwar Germany evidence chain."
  },
  {
    "searchId": "postwar-germany-search-002",
    "date": "2026-08-13",
    "query": "postwar Germany Berufsverbot democratic restriction memory politics counterevidence",
    "database": "PPW counterevidence audit",
    "purpose": "disconfirming",
    "inclusionCriteria": [
      "evidence that qualifies high-corrigibility claims",
      "practice-level restrictions or memory-politics disputes after constitutional adoption"
    ],
    "exclusionCriteria": [
      "evidence unrelated to postwar democratic corrigibility"
    ],
    "resultsCount": 1,
    "screenedCount": 1,
    "includedSourceIds": [],
    "notes": "Search records the current counterclaim direction. Follow-up sourcing is required before any publication-facing use."
  }
]
